### ISSUE TITLE
authentication issue.

### ISSUE THREAD

**Issue by aplsms** [nickv2002/Transmission-Remote-MacOS#7]
hello,
I have authentication issue.
Setting login and password return: Reached the server, but authentication was rejected (HTTP 401). Check the username and password.
curl with the same parameters is working well.

tcpdump is showing that POST request returning 301 redirect, but next get request returns 401

Curl example:
```
$ curl -v  --user "rpcuser:YJz6xHWGCoZFb"  http://backup.petrenko.me:27062/f4694b9405440e7446b59c2f5d9b7198/web/
*   Trying 10.10.21.143...
* TCP_NODELAY set
* Connected to backup.petrenko.me (10.10.21.143) port 27062 (#0)
* Server auth using Basic with user 'rpcuser'
> GET /f4694b9405440e7446b59c2f5d9b7198/web/ HTTP/1.1
> Host: backup.petrenko.me:27062
> Authorization: Basic cnBjdXNlcjpZSno2eEhXR0NvWkZi
> User-Agent: curl/7.61.1
> Accept: */*
>
< HTTP/1.1 200 OK
< Server: Transmission
< X-Frame-Options: SAMEORIGIN
< Content-Security-Policy: frame-ancestors 'self'
< Content-Type: text/html
< Date: Sun, 06 Sep 2026 18:04:48 GMT
< Content-Length: 3715
<
<!doctype html>
<html lang="en" xml:lang="en">
  <head>
```

POST:
```
Frame 402: Packet, 91 bytes on wire (728 bits), 91 bytes captured (728 bits) on interface utun10, id 0
Raw packet data
Internet Protocol Version 4, Src: 10.10.81.6, Dst: 10.10.21.143
Transmission Control Protocol, Src Port: 55172, Dst Port: 27062, Seq: 366, Ack: 1, Len: 39
[2 Reassembled TCP Segments (404 bytes): #401(365), #402(39)]
Hypertext Transfer Protocol
    POST /f4694b9405440e7446b59c2f5d9b7198 HTTP/1.1\r\n
        Request Method: POST
        Request URI: /f4694b9405440e7446b59c2f5d9b7198
        Request Version: HTTP/1.1
    Host: 10.10.21.143:27062\r\n
    Content-Type: application/json\r\n
    User-Agent: Transmission%20Remote/2026.08.25.1 CFNetwork/3860.700.1 Darwin/25.6.0\r\n
    Connection: keep-alive\r\n
    Accept: */*\r\n
    Accept-Language: en-US,en;q=0.9\r\n
    Content-Length: 39\r\n
        [Content length: 39]
    Accept-Encoding: gzip, deflate\r\n
    Authorization: Basic cnBjdXNlcjpZSno2eEhXR0NvWkZi\r\n
        Credentials: rpcuser:YJz6xHWGCoZFb
    \r\n
    [Response in frame: 407]
    [Full request URI: http://10.10.21.143:27062/f4694b9405440e7446b59c2f5d9b7198]
    File Data: 39 bytes
JavaScript Object Notation: application/json
    Object
        Member: method
            [Path with value: /method:session-get]
            [Member with value: method:session-get]
            String value: session-get
            Key: method
            [Path: /method]
        Member: arguments
            Object
            Key: arguments
            [Path: /arguments]

Frame 407: Packet, 369 bytes on wire (2952 bits), 369 bytes captured (2952 bits) on interface utun10, id 0
Raw packet data
Internet Protocol Version 4, Src: 10.10.21.143, Dst: 10.10.81.6
Transmission Control Protocol, Src Port: 27062, Dst Port: 55172, Seq: 1, Ack: 405, Len: 317
Hypertext Transfer Protocol
    HTTP/1.1 301 Moved Permanently\r\n
        Response Version: HTTP/1.1
        Status Code: 301
        [Status Code Description: Moved Permanently]
        Response Phrase: Moved Permanently
    Server: Transmission\r\n
    X-Frame-Options: SAMEORIGIN\r\n
    Content-Security-Policy: frame-ancestors 'self'\r\n
    Location: /f4694b9405440e7446b59c2f5d9b7198/web/\r\n
    Date: Sun, 06 Sep 2026 18:10:34 GMT\r\n
    Content-Length: 31\r\n
        [Content length: 31]
    Content-Type: text/html; charset=ISO-8859-1\r\n
    \r\n
    [Request in frame: 402]
    [Time since request: 35.817000 milliseconds]
    [Request URI: /f4694b9405440e7446b59c2f5d9b7198]
    [Full request URI: http://10.10.21.143:27062/f4694b9405440e7446b59c2f5d9b7198]
    File Data: 31 bytes
Line-based text data: text/html (1 lines)
    <h1>301: Moved Permanently</h1>


```

next GET:

```
Frame 409: Packet, 318 bytes on wire (2544 bits), 318 bytes captured (2544 bits) on interface utun10, id 0
Raw packet data
Internet Protocol Version 4, Src: 10.10.81.6, Dst: 10.10.21.143
Transmission Control Protocol, Src Port: 55172, Dst Port: 27062, Seq: 405, Ack: 318, Len: 266
Hypertext Transfer Protocol
    GET /f4694b9405440e7446b59c2f5d9b7198/web/ HTTP/1.1\r\n
        Request Method: GET
        Request URI: /f4694b9405440e7446b59c2f5d9b7198/web/
        Request Version: HTTP/1.1
    Host: 10.10.21.143:27062\r\n
    User-Agent: Transmission%20Remote/2026.08.25.1 CFNetwork/3860.700.1 Darwin/25.6.0\r\n
    Accept: */*\r\n
    Accept-Encoding: gzip, deflate\r\n
    Connection: keep-alive\r\n
    Accept-Language: en-US,en;q=0.9\r\n
    \r\n
    [Response in frame: 416]
    [Full request URI: http://10.10.21.143:27062/f4694b9405440e7446b59c2f5d9b7198/web/]


Frame 416: Packet, 355 bytes on wire (2840 bits), 355 bytes captured (2840 bits) on interface utun10, id 0
Raw packet data
Internet Protocol Version 4, Src: 10.10.21.143, Dst: 10.10.81.6
Transmission Control Protocol, Src Port: 27062, Dst Port: 55172, Seq: 318, Ack: 671, Len: 303
Hypertext Transfer Protocol
    HTTP/1.1 401 Unauthorized\r\n
        Response Version: HTTP/1.1
        Status Code: 401
        [Status Code Description: Unauthorized]
        Response Phrase: Unauthorized
    Server: Transmission\r\n
    X-Frame-Options: SAMEORIGIN\r\n
    Content-Security-Policy: frame-ancestors 'self'\r\n
    WWW-Authenticate: Basic realm="Transmission"\r\n
    Date: Sun, 06 Sep 2026 18:10:34 GMT\r\n
    Content-Length: 26\r\n
        [Content length: 26]
    Content-Type: text/html; charset=ISO-8859-1\r\n
    \r\n
    [Request in frame: 409]
    [Time since request: 41.020000 milliseconds]
    [Request URI: /f4694b9405440e7446b59c2f5d9b7198/web/]
    [Full request URI: http://10.10.21.143:27062/f4694b9405440e7446b59c2f5d9b7198/web/]
    File Data: 26 bytes
Line-based text data: text/html (1 lines)
    <h1>401: Unauthorized</h1>

```

Transmission remote: Version 2026.08.25.1 (2026.08.25.1)
Transmission: Transmission  4.1.3 838877323f

**Comment by nickv2002** [comment]
I see you closed this hopefully not a problem in Transmission Remote Client here. LMK if not.
I do use HTTP Basic Authentication on my own server and don't have any issues so I would be surprised if that was a case elsewhere.
